{"actual_orders_placed":false,"artifact_sha256":"ade0399bb12fe65f719471e69c50e028d1845a3c20623328070cb4d3550c0751","campaign_family":"v5_four_colony_offline_verification","colony":"execution_evidence","current_evidence_audit_sha256":"63deba8988f9a8f282348e142174db3fc2b743aaba62a9d1b68881b2c9fa70c0","execution_colony_gate_passed":false,"network_used":false,"observed_promotion_eligible_selected_trades":0,"observed_promotion_grade_event_window_coverage":0.0,"promotion_ready":false,"protected_final_read":false,"protected_label_access_authorized":false,"registered_minimum_event_window_coverage":0.9,"registered_minimum_selected_trades":30,"registration_sha256":"f285210dba0ee391989ceb3b1ab8ce41985898cfa99d8bf04c397d199d2955d3","schema_version":"klax-v5-execution-readiness-verdict-v1","source_census_sha256":"38d92e5184a9e3506aae18c61113df75ab5028bbcfdf2e82808604d0013316b6","status":"BLOCKED","unmet_gates":["PROMOTION_GRADE_SOURCE"],"verdict":"EXECUTION_EVIDENCE_UNAVAILABLE"}
